{
  "$schema": "https://json-schema.org/draft/2020-12/schema",
  "type": "object",
  "properties": {
    "name": { "type": "string" },
    "version": { "type": "string" },
    "only": { "type": "boolean" },
    "skip": { "type": "boolean" },
    "cypressTopWindowReplacement": { "type": "boolean" },
    "hostSdkVersion": {
      "type": "object",
      "properties": {
        "web": { "type": "string" },
        "android": { "type": "string" },
        "ios": { "type": "string" }
      },
      "additionalProperties": false
    },
    "checkIsSupported": {
      "type": "object",
      "properties": {
        "capabilityName": { "type": "string" },
        "domElementName": { "type": "string" },
        "expectedOutput": { "type": "string" },
        "toggleId": { "type": "string" },
        "version": { "type": "string" },
        "testUrlParams": { "$ref": "#/$defs/testUrlParams" }
      },
      "additionalProperties": false
    },
    "platforms": {
      "oneOf": [{ "type": "string" }, { "type": "array", "items": { "type": "string" } }]
    },
    "testUrlParams": { "$ref": "#/$defs/testUrlParams" },
    "testCases": {
      "type": "array",
      "items": {
        "allOf": [
          {
            "type": "object",
            "properties": {
              "title": { "type": "string" },
              "version": { "type": "string" },
              "hostSdkVersion": {
                "type": "object",
                "properties": {
                  "web": { "type": "string" },
                  "android": { "type": "string" },
                  "ios": { "type": "string" }
                },
                "additionalProperties": false
              },
              "platformsExcluded": {
                "type": "array",
                "items": { "type": "string" }
              },
              "only": { "type": "boolean" },
              "testUrlParams": { "$ref": "#/$defs/testUrlParams" },
              "expectedAlertValue": {
                "oneOf": [{ "type": "string" }, { "type": "array", "items": { "type": "string" } }]
              },
              "expectedWindowOpenTarget": { "type": "string" },
              "expectedIFrameTarget": { "type": "string" },
              "expectedSecondViewTarget": { "type": "string" },
              "modulesToDisable": {
                "type": "array",
                "items": { "type": "string" }
              },
              "skipForCallbackBasedRuns": { "type": "boolean" },
              "unitCovered": {
                "type": "boolean",
                "description": "Marks fixture cases selected by the Hub SDK provider contract suites for supported families. The flag selects provider tests; it does not prove that a teams-js producer test also covers the case or change browser E2E scheduling (see e2eScope)."
              },
              "e2eScope": {
                "type": "string",
                "enum": ["pr", "shadow"],
                "description": "Which browser E2E runs execute this case. 'pr' (default when omitted) runs it in the PR pipeline; 'shadow' moves it off the PR critical path to the scheduled run, which is only appropriate once unitCovered replacements exist and evidence has been collected. A case is never deleted by this field."
              }
            },
            "required": ["title"]
          },
          {
            "type": "object",
            "oneOf": [
              {
                "properties": {
                  "type": { "const": "callResponse" },
                  "boxSelector": { "type": "string" },
                  "inputValue": {},
                  "skipJsonStringifyOnInputValue": { "type": "boolean" },
                  "checkboxState": { "type": "boolean" },
                  "expectedTestAppValue": { "type": "string" },
                  "isRequestPermissionCall": {
                    "type": "object",
                    "properties": {
                      "repeatRequestPermissionCall": { "type": "boolean" }
                    }
                  },
                  "requestPermissionBeforeThisCall": {
                    "type": "object",
                    "properties": {
                      "boxSelector": { "type": "string" },
                      "consentPermission": {
                        "oneOf": [{ "type": "boolean" }, { "type": "string", "enum": ["Allow"] }]
                      },
                      "expectedOutput": { "type": "string" }
                    },
                    "required": ["boxSelector", "consentPermission"]
                  }
                },
                "required": ["boxSelector"]
              },
              {
                "properties": {
                  "type": { "const": "raiseEvent" },
                  "eventName": { "type": "string" },
                  "eventData": {}
                },
                "required": ["eventName"]
              },
              {
                "properties": {
                  "type": { "const": "registerAndRaiseEvent" },
                  "boxSelector": { "type": "string" },
                  "inputValue": {},
                  "eventName": { "type": "string" },
                  "eventData": {},
                  "expectedAlertValueOnRegistration": {
                    "oneOf": [{ "type": "string" }, { "type": "array", "items": { "type": "string" } }]
                  },
                  "expectedTestAppValue": { "type": "string" }
                },
                "required": ["boxSelector", "eventName"]
              }
            ]
          }
        ],
        "unevaluatedProperties": false,
        "required": ["type"]
      }
    },
    "featureTests": {
      "type": "array",
      "items": {
        "type": "object",
        "properties": {
          "feature": {
            "type": "object",
            "properties": {
              "id": { "type": "string" },
              "version": { "type": "number" }
            },
            "required": ["id", "version"],
            "additionalProperties": false
          },
          "testCases": {
            "$ref": "#/properties/testCases"
          }
        },
        "required": ["feature", "testCases"],
        "additionalProperties": false
      }
    }
  },
  "anyOf": [
    {
      "required": ["name", "testCases"]
    },
    {
      "required": ["name", "featureTests"]
    }
  ],
  "required": ["name"],
  "additionalProperties": false,
  "$defs": {
    "testUrlParams": {
      "type": "array",
      "items": {
        "type": "array",
        "prefixItems": [
          { "enum": ["env", "appDefOverrides", "sessionId", "frameContext", "hostClientType", "hostView"] },
          { "type": "string" }
        ]
      }
    }
  }
}
