{
  "name": "Profile",
  "platforms": "Web",
  "version": ">2.5.0",
  "checkIsSupported": {
    "domElementName": "checkCapabilityProfile"
  },
  "testCases": [
    {
      "title": "showProfile API Call - Success",
      "type": "callResponse",
      "hostSdkVersion": {
        "web": "<9.15.0"
      },
      "boxSelector": "#box_showProfile",
      "inputValue": {
        "modality": "Card",
        "persona": {
          "identifiers": {
            "Smtp": "test@microsoft.com"
          }
        },
        "targetElementBoundingRect": {
          "x": 0,
          "y": 0,
          "width": 0,
          "height": 0
        },
        "triggerType": "MouseClick"
      },
      "expectedAlertValue": "showProfile called with {\"modality\":\"Card\",\"persona\":{\"identifiers\":{\"Smtp\":\"test@microsoft.com\"}},\"targetElementBoundingRect\":{\"x\":243,\"y\":0,\"width\":0,\"height\":0,\"top\":0,\"right\":243,\"bottom\":0,\"left\":243},\"triggerType\":\"MouseClick\"}"
    },
    {
      "title": "showProfile API Call - Success",
      "type": "callResponse",
      "hostSdkVersion": {
        "web": ">9.15.1"
      },
      "boxSelector": "#box_showProfile",
      "inputValue": {
        "modality": "Card",
        "persona": {
          "identifiers": {
            "Smtp": "test@microsoft.com"
          }
        },
        "targetElementBoundingRect": {
          "x": 0,
          "y": 0,
          "width": 0,
          "height": 0
        },
        "triggerType": "MouseClick"
      },
      "expectedAlertValue": "regex:showProfile called with .*\"Smtp\":\"test@microsoft.com\".*\"triggerType\":\"MouseClick\""
    }
  ]
}
