{
  "name": "BarCode",
  "platforms": "Web",
  "version": ">=2.1.0",
  "checkIsSupported": {
    "domElementName": "checkBarCodeCapability",
    "expectedOutput": "BarCode is not supported"
  },
  "testCases": [
    {
      "title": "requestBarCodePermission API Call - Success",
      "type": "callResponse",
      "boxSelector": "#box_requestBarCodePermission",
      "isRequestPermissionCall": { "repeatRequestPermissionCall": false },
      "expectedTestAppValue": "true",
      "skipForCallbackBasedRuns": true
    },
    {
      "title": "repeated requestBarCodePermission API Call with no dialog- Success",
      "type": "callResponse",
      "boxSelector": "#box_requestBarCodePermission",
      "isRequestPermissionCall": { "repeatRequestPermissionCall": true },
      "expectedTestAppValue": "true",
      "skipForCallbackBasedRuns": true
    },
    {
      "title": "hasBarCodePermission API Call - Success",
      "type": "callResponse",
      "boxSelector": "#box_hasBarCodePermission",
      "expectedTestAppValue": "false",
      "skipForCallbackBasedRuns": true
    },
    {
      "title": "scanBarCode API Call - Success",
      "type": "callResponse",
      "boxSelector": "#box_scanBarCode",
      "requestPermissionBeforeThisCall": {
        "boxSelector": "#box_requestBarCodePermission",
        "consentPermission": true
      },
      "inputValue": {},
      "expectedTestAppValue": "\"scannedCode\"",
      "expectedAlertValue": ["scanBarCode called with {}"],
      "skipForCallbackBasedRuns": true
    },
    {
      "title": "scanBarCode API Call - Failure",
      "type": "callResponse",
      "version": ">2.16.0",
      "boxSelector": "#box_scanBarCode",
      "requestPermissionBeforeThisCall": {
        "boxSelector": "#box_requestBarCodePermission",
        "consentPermission": false
      },
      "inputValue": {},
      "expectedTestAppValue": "Error: {\"errorCode\":1000,\"message\":\"user has explicitly not consented for device permission\"}",
      "skipForCallbackBasedRuns": true
    }
  ]
}
