{
  "name": "SecondaryBrowser",
  "version": ">=2.12.0",
  "platforms": "iOS",
  "checkIsSupported": {},
  "testCases": [
    {
      "title": "openUrl API Call - Success",
      "type": "callResponse",
      "boxSelector": "#box_secondaryBrowser_open",
      "inputValue": "https://www.bing.com",
      "expectedSecondViewTarget": "SFSafariViewController"
    }
  ]
}
