{
  "name": "Sharing",
  "platforms": "Web",
  "checkIsSupported": {
    "expectedOutput": "Sharing is not supported"
  },
  "testCases": [
    {
      "title": "shareWebContent API Call - Success",
      "type": "callResponse",
      "boxSelector": "#box_share_shareWebContent",
      "inputValue": {
        "content": [
          {
            "type": "URL",
            "url": "https://bing.com",
            "message": "def"
          }
        ]
      },
      "expectedAlertValue": "shareWebContent called with ##JSON_INPUT_VALUE##",
      "unitCovered": true
    },
    {
      "title": "shareWebContent API Call - File type - Success",
      "type": "callResponse",
      "version": ">2.52.0",
      "boxSelector": "#box_share_shareWebContent",
      "inputValue": {
        "content": [
          {
            "type": "FILE",
            "url": "https://contoso.sharepoint.com/sites/team/Shared%20Documents/report.docx",
            "message": "Check this file"
          }
        ]
      },
      "expectedAlertValue": "shareWebContent called with ##JSON_INPUT_VALUE##"
    }
  ]
}
